{
  "event_id": "ev_001",
  "case_execution_id": "cx_001",
  "sequence": 0,
  "event_type": "invocation_started",
  "actor": "harness.orchestrator",
  "timestamp": "2026-07-17T12:00:00Z",
  "input_refs": ["case:request_triage_001#v1"],
  "output_refs": [],
  "state_transition": { "from": "PENDING", "to": "INVOKING" },
  "payload_ref": null,
  "content_hash": null
}
